{
  "$schema": "https://json-schema.org/draft/2020-12/schema",
  "title": "QuoteCandidatesPack",
  "type": "object",
  "required": ["quote_candidates"],
  "additionalProperties": false,
  "properties": {
    "schema_version": { "type": "string" },
    "quote_candidates": {
      "type": "array",
      "items": {
        "type": "object",
        "required": ["text"],
        "additionalProperties": false,
        "properties": {
          "id": { "type": "string" },
          "text": { "type": "string" },
          "source": { "type": "string" },
          "page": {
            "description": "One-based physical PDF page index containing the quote, or null when unknown.",
            "type": ["integer", "null"],
            "minimum": 1
          }
        }
      }
    },
    "not_found_reason": { "type": "string" },
    "_cache": { "type": "object", "additionalProperties": true },
    "family_status": {
      "type": "object",
      "required": [
        "schema_version",
        "family",
        "source",
        "status",
        "confidence_score",
        "policy_action",
        "reason"
      ],
      "properties": {
        "schema_version": { "type": "string" },
        "family": { "type": "string" },
        "source": { "type": "string", "enum": ["evidence_pack"] },
        "status": { "type": "string", "enum": ["generated", "abstained"] },
        "confidence_score": { "type": "number" },
        "policy_action": {
          "type": "string",
          "enum": ["keep", "regenerate", "abstain"]
        },
        "reason": { "type": "string" }
      }
    }
  }
}
